{
  "schema_version": "1.0.0",
  "name": "B200 (Blackwell, GB200 NVL72 variant)",
  "aliases": [
    "Blackwell B200 SXM (rack-scale binning)"
  ],
  "manufacturer": "NVIDIA",
  "architecture": "Blackwell",
  "gpu_chip": null,
  "process_node_nm": 4,
  "release_date": "2024-03-18",
  "status": "shipping",
  "form_factor": "SXM",
  "sxm_generation": "SXM6",
  "nvlink_bridge_gpu_count": null,
  "slot_width": null,
  "tdp_watts_max": 1200,
  "cooling_type": "liquid",
  "fp64_tflops": 40,
  "fp64_tensor_tflops": 40,
  "fp32_tflops": 80,
  "tf32_tensor_tflops": null,
  "tf32_tensor_sparse_tflops": 2500,
  "fp16_tflops": null,
  "fp16_tensor_tflops": null,
  "fp16_tensor_sparse_tflops": 5000,
  "bf16_tensor_tflops": null,
  "bf16_tensor_sparse_tflops": 5000,
  "fp8_tensor_tflops": null,
  "fp8_tensor_sparse_tflops": 10000,
  "fp6_tensor_tflops": null,
  "fp6_tensor_sparse_tflops": 10000,
  "fp4_tensor_tflops": null,
  "fp4_tensor_sparse_tflops": 20000,
  "int8_tensor_tops": null,
  "int8_tensor_sparse_tops": 10000,
  "memory_capacity_gb": 186,
  "memory_type": "HBM3e",
  "memory_bus_width_bits": null,
  "memory_bandwidth_gbps": 8000,
  "ecc_supported": true,
  "nvlink_generation": 5,
  "nvlink_bandwidth_gbps": 1800,
  "nvlink_max_domain_size": 72,
  "pcie_generation": 5,
  "pcie_bandwidth_gbps": 128,
  "c2c_bandwidth_gbps": 900,
  "cuda_cores": null,
  "tensor_cores": null,
  "tensor_core_generation": 5,
  "rt_cores": null,
  "rt_core_generation": null,
  "sm_count": null,
  "multi_instance_max": 7,
  "last_verified": "2026-09-06",
  "notes": "Same 'Blackwell' silicon as b200-sxm-hgx.json, but binned to a higher power/thermal envelope (1200W vs 1000W) when deployed in the liquid-cooled GB200 NVL72 rack, yielding higher memory capacity (186GB vs 180GB), bandwidth (8 vs 7.7 TB/s), and compute across every Tensor Core precision. Per the official NVIDIA Blackwell datasheet's footnote 1, all Tensor Core figures except FP64 are shown as sparse-only (no dense value independently published) -- dense fields left null. FP8 and FP6 Tensor Core published as a single combined figure -- both fields carry the same source value. c2c_bandwidth_gbps of 900 GB/s (aggregate bidirectional NVLink-C2C to the Grace CPU) is documented at the GB200 Grace Blackwell Superchip level (1 Grace : 2 GPUs) in this datasheet's 'Decompression Engine' sidebar text, not stated as an explicit per-GPU figure -- recorded here as the superchip-level aggregate since the schema has no separate superchip tier.",
  "sources": [
    "https://www.primeline-solutions.com/media/categories/server/nach-gpu/nvidia-hgx-h200/nvidia-blackwell-b200-datasheet.pdf"
  ],
  "_sources": {
    "release_date": "https://nvidianews.nvidia.com/news/nvidia-blackwell-platform-arrives-to-power-a-new-era-of-computing (GTC 2024 keynote, March 18 2024)",
    "memory_bandwidth_gbps": "https://www.primeline-solutions.com/media/categories/server/nach-gpu/nvidia-hgx-h200/nvidia-blackwell-b200-datasheet.pdf (p.7, Technical Specifications table)",
    "c2c_bandwidth_gbps": "https://www.primeline-solutions.com/media/categories/server/nach-gpu/nvidia-hgx-h200/nvidia-blackwell-b200-datasheet.pdf (p.8, Decompression Engine sidebar: '900 gigabytes per second (GB/s) of bidirectional bandwidth' to Grace CPU)"
  }
}
