{
  "schema_version": "1.0.0",
  "name": "B300 (Blackwell Ultra, HGX)",
  "aliases": [
    "Blackwell Ultra B300 SXM"
  ],
  "manufacturer": "NVIDIA",
  "architecture": "Blackwell Ultra",
  "gpu_chip": null,
  "process_node_nm": 4,
  "release_date": "2025-03-18",
  "status": "shipping",
  "form_factor": "SXM",
  "sxm_generation": "SXM6",
  "nvlink_bridge_gpu_count": null,
  "slot_width": null,
  "tdp_watts_max": 1100,
  "cooling_type": "liquid",
  "fp64_tflops": 1.2,
  "fp64_tensor_tflops": 1.2,
  "fp32_tflops": 75,
  "tf32_tensor_tflops": null,
  "tf32_tensor_sparse_tflops": 2200,
  "fp16_tflops": null,
  "fp16_tensor_tflops": null,
  "fp16_tensor_sparse_tflops": 4500,
  "bf16_tensor_tflops": null,
  "bf16_tensor_sparse_tflops": 4500,
  "fp8_tensor_tflops": null,
  "fp8_tensor_sparse_tflops": 9000,
  "fp6_tensor_tflops": null,
  "fp6_tensor_sparse_tflops": 9000,
  "fp4_tensor_tflops": 14000,
  "fp4_tensor_sparse_tflops": 18000,
  "int8_tensor_tops": null,
  "int8_tensor_sparse_tops": 307000,
  "memory_capacity_gb": 270,
  "memory_type": "HBM3E",
  "memory_bus_width_bits": null,
  "memory_bandwidth_gbps": 7700,
  "ecc_supported": true,
  "nvlink_generation": 5,
  "nvlink_bandwidth_gbps": 1800,
  "nvlink_max_domain_size": 8,
  "pcie_generation": 6,
  "pcie_bandwidth_gbps": 256,
  "c2c_bandwidth_gbps": null,
  "cuda_cores": null,
  "tensor_cores": null,
  "tensor_core_generation": 5,
  "rt_cores": null,
  "rt_core_generation": null,
  "sm_count": null,
  "multi_instance_max": 7,
  "last_verified": "2026-09-06",
  "notes": "FP8 and FP6 Tensor Core throughput published as a single combined figure by NVIDIA (shared tensor core datapath on Blackwell Ultra) -- both fields carry the same source value. Dense figures for FP8/FP6/FP16/BF16/TF32/INT8 not independently published; NVIDIA footnote states dense = sparse / 2, not recorded here as those fields since that would be a derived, not sourced, value.",
  "sources": [
    "https://resources.nvidia.com/en-us-blackwell-architecture/blackwell-ultra-datasheet"
  ],
  "_sources": {
    "release_date": "https://nvidianews.nvidia.com/news/nvidia-blackwell-ultra-ai-factory-platform-paves-way-for-age-of-ai-reasoning (GTC 2025, March 18 2025)",
    "process_node_nm": "https://developer.nvidia.com/blog/inside-nvidia-blackwell-ultra-the-chip-powering-the-ai-factory-era/ ('Blackwell Ultra is manufactured using TSMC 4NP'; side-by-side table confirms same TSMC 4NP as B200)",
    "memory_bandwidth_gbps": "https://resources.nvidia.com/en-us-blackwell-architecture/blackwell-ultra-datasheet (p.5, Technical Specifications table)"
  }
}
