{
  "schema_version": "1.0.0",
  "name": "A100 SXM4 80GB",
  "aliases": [
    "A100 80GB SXM"
  ],
  "manufacturer": "NVIDIA",
  "architecture": "Ampere",
  "gpu_chip": "GA100",
  "process_node_nm": 7,
  "release_date": "2020-11-16",
  "status": "shipping",
  "form_factor": "SXM",
  "sxm_generation": "SXM4",
  "nvlink_bridge_gpu_count": null,
  "slot_width": null,
  "tdp_watts_max": 400,
  "cooling_type": null,
  "fp64_tflops": 9.7,
  "fp64_tensor_tflops": 19.5,
  "fp32_tflops": 19.5,
  "tf32_tensor_tflops": 156,
  "tf32_tensor_sparse_tflops": 312,
  "fp16_tflops": null,
  "fp16_tensor_tflops": 312,
  "fp16_tensor_sparse_tflops": 624,
  "bf16_tensor_tflops": 312,
  "bf16_tensor_sparse_tflops": 624,
  "fp8_tensor_tflops": null,
  "fp8_tensor_sparse_tflops": null,
  "fp6_tensor_tflops": null,
  "fp6_tensor_sparse_tflops": null,
  "fp4_tensor_tflops": null,
  "fp4_tensor_sparse_tflops": null,
  "int8_tensor_tops": 624,
  "int8_tensor_sparse_tops": 1248,
  "memory_capacity_gb": 80,
  "memory_type": "HBM2e",
  "memory_bus_width_bits": null,
  "memory_bandwidth_gbps": 2039,
  "ecc_supported": true,
  "nvlink_generation": 3,
  "nvlink_bandwidth_gbps": 600,
  "nvlink_max_domain_size": 8,
  "pcie_generation": 4,
  "pcie_bandwidth_gbps": 64,
  "c2c_bandwidth_gbps": null,
  "cuda_cores": 6912,
  "tensor_cores": 432,
  "tensor_core_generation": 3,
  "rt_cores": null,
  "rt_core_generation": null,
  "sm_count": 108,
  "multi_instance_max": 7,
  "last_verified": "2026-09-06",
  "notes": "FP8/FP6/FP4 Tensor Core fields are null because Ampere does not support these precisions at all -- not merely unpublished. No plain (non-Tensor-Core) FP16 vector figure is published by NVIDIA for A100. tdp_watts_max of 400W is the standard SXM4 configuration; datasheet footnote notes a custom-thermal-solution (CTS) HGX A100-80GB SKU can support up to 500W, not recorded as a separate field since it's a non-standard/custom config rather than a distinct catalog SKU. MIG: up to 7 instances @ 10GB each.",
  "sources": [
    "https://www.nvidia.com/content/dam/en-zz/Solutions/Data-Center/a100/pdf/nvidia-a100-datasheet-us-nvidia-1758950-r4-web.pdf"
  ],
  "_sources": {
    "release_date": "http://nvidianews.nvidia.com/news/nvidia-doubles-down-announces-a100-80gb-gpu-supercharging-worlds-most-powerful-gpu-for-ai-supercomputing (SC20, Nov 16 2020 -- separate later announcement for the 80GB variant, distinct from the original 40GB launch)",
    "cuda_cores": "https://www.nvidia.com/content/dam/en-zz/Solutions/Data-Center/nvidia-ampere-architecture-whitepaper.pdf",
    "tensor_cores": "https://www.nvidia.com/content/dam/en-zz/Solutions/Data-Center/nvidia-ampere-architecture-whitepaper.pdf",
    "sm_count": "https://www.nvidia.com/content/dam/en-zz/Solutions/Data-Center/nvidia-ampere-architecture-whitepaper.pdf",
    "process_node_nm": "https://www.nvidia.com/content/dam/en-zz/Solutions/Data-Center/nvidia-ampere-architecture-whitepaper.pdf",
    "tdp_watts_max": "https://www.nvidia.com/content/dam/en-zz/Solutions/Data-Center/a100/pdf/nvidia-a100-datasheet-us-nvidia-1758950-r4-web.pdf (footnote: 400W standard; custom-thermal-solution HGX A100-80GB CTS SKU supports up to 500W)"
  }
}
