{
  "schema_version": "1.0.0",
  "name": "V100 SXM2 32GB",
  "aliases": [],
  "manufacturer": "NVIDIA",
  "architecture": "Volta",
  "gpu_chip": "GV100",
  "process_node_nm": 12,
  "release_date": "2017-05-10",
  "status": "shipping",
  "form_factor": "SXM",
  "sxm_generation": "SXM2",
  "nvlink_bridge_gpu_count": null,
  "slot_width": null,
  "tdp_watts_max": 300,
  "cooling_type": null,
  "fp64_tflops": 7.8,
  "fp64_tensor_tflops": null,
  "fp32_tflops": 15.7,
  "tf32_tensor_tflops": null,
  "tf32_tensor_sparse_tflops": null,
  "fp16_tflops": null,
  "fp16_tensor_tflops": 125,
  "fp16_tensor_sparse_tflops": null,
  "bf16_tensor_tflops": null,
  "bf16_tensor_sparse_tflops": null,
  "fp8_tensor_tflops": null,
  "fp8_tensor_sparse_tflops": null,
  "fp6_tensor_tflops": null,
  "fp6_tensor_sparse_tflops": null,
  "fp4_tensor_tflops": null,
  "fp4_tensor_sparse_tflops": null,
  "int8_tensor_tops": null,
  "int8_tensor_sparse_tops": null,
  "memory_capacity_gb": 32,
  "memory_type": "HBM2",
  "memory_bus_width_bits": null,
  "memory_bandwidth_gbps": 900,
  "ecc_supported": true,
  "nvlink_generation": 2,
  "nvlink_bandwidth_gbps": 300,
  "nvlink_max_domain_size": 8,
  "pcie_generation": null,
  "pcie_bandwidth_gbps": null,
  "c2c_bandwidth_gbps": null,
  "cuda_cores": 5120,
  "tensor_cores": 640,
  "tensor_core_generation": 1,
  "rt_cores": null,
  "rt_core_generation": null,
  "sm_count": null,
  "multi_instance_max": null,
  "last_verified": "2026-09-06",
  "notes": "release_date of 2017-05-10 is confirmed for the original V100 platform/16GB SXM2 launch (GTC 2017 keynote). The specific 32GB SXM2 SKU modeled in this record was a later memory-capacity refresh (widely cited elsewhere as following around GTC 2018, March 2018), and a dedicated NVIDIA press release explicitly announcing '32GB' as its own dated event was not found in the research pass for this record -- record this date with LOWER confidence for the 32GB variant specifically than it would carry for the original 16GB launch; treat as the best available anchor date pending a follow-up source. TF32/BF16/FP8/FP64-Tensor-Core/structured-sparsity fields are null because Volta predates all of these (introduced starting with Ampere) -- not merely unpublished. FP16 Tensor Core figure (125 TFLOPS) is inherently dense; sparsity as a concept did not exist yet, so fp16_tensor_sparse_tflops is left null rather than treated as equal to the dense figure. INT8 Tensor Core throughput not found in NVIDIA's official V100 datasheet -- it lists only a single 'Tensor Performance' (FP16) row, no INT8 TOPS breakout, so int8_tensor_tops is left null rather than estimated. multi_instance_max is null because MIG was not introduced until Ampere -- V100 predates it entirely (confirmed via NVIDIA's official MIG User Guide supported-GPU list, which starts at Ampere GA100/Hopper). pcie_generation/pcie_bandwidth_gbps are null because the SXM2 form factor's official 'System Interface' is NVLink, not PCIe (PCIe applies only to the separate V100 PCIe/V100S PCIe SKUs, not modeled here). nvlink_generation of 2 reflects the commonly-used 'NVLink 2.0' designation; the datasheet itself only states '2X higher throughput compared to the previous generation [Pascal]' without using the literal string 'NVLink 2.0'. nvlink_max_domain_size of 8 reflects the DGX-1/HGX-1 8-GPU SXM2 baseboard convention, though V100's NVLink topology (hybrid cube-mesh) is not a fully-connected any-to-any mesh like later NVSwitch-based systems -- recorded as GPU count in the baseboard, not a claim about full connectivity. sm_count not found in any official source checked.",
  "sources": [
    "https://images.nvidia.com/content/technologies/volta/pdf/volta-v100-datasheet-update-us-1165301-r5.pdf"
  ],
  "_sources": {
    "release_date": "https://nvidianews.nvidia.com/news/nvidia-launches-revolutionary-volta-gpu-platform-fueling-next-era-of-ai-and-high-performance-computing (GTC 2017, May 10 2017 -- V100 platform launch date; the 32GB SXM2 SKU specifically is a later, unconfirmed-date memory refresh, see notes)",
    "process_node_nm": "https://images.nvidia.com/content/volta-architecture/pdf/volta-architecture-whitepaper.pdf (p.168: TSMC 12nm FFN custom process)",
    "multi_instance_max": "https://docs.nvidia.com/datacenter/tesla/mig-user-guide/supported-gpus.html (MIG-supported GPU list begins at Ampere GA100/Hopper; V100 absent)"
  }
}
