{
  "schema_version": "1.0.0",
  "name": "H200 SXM",
  "aliases": [
    "H200 SXM5 141GB"
  ],
  "manufacturer": "NVIDIA",
  "architecture": "Hopper",
  "gpu_chip": "GH100",
  "process_node_nm": 4,
  "release_date": "2023-11-13",
  "status": "shipping",
  "form_factor": "SXM",
  "sxm_generation": "SXM5",
  "nvlink_bridge_gpu_count": null,
  "slot_width": null,
  "tdp_watts_max": 700,
  "cooling_type": null,
  "fp64_tflops": 34,
  "fp64_tensor_tflops": 67,
  "fp32_tflops": 67,
  "tf32_tensor_tflops": null,
  "tf32_tensor_sparse_tflops": 989,
  "fp16_tflops": null,
  "fp16_tensor_tflops": null,
  "fp16_tensor_sparse_tflops": 1979,
  "bf16_tensor_tflops": null,
  "bf16_tensor_sparse_tflops": 1979,
  "fp8_tensor_tflops": null,
  "fp8_tensor_sparse_tflops": 3958,
  "fp6_tensor_tflops": null,
  "fp6_tensor_sparse_tflops": null,
  "fp4_tensor_tflops": null,
  "fp4_tensor_sparse_tflops": null,
  "int8_tensor_tops": null,
  "int8_tensor_sparse_tops": 3958,
  "memory_capacity_gb": 141,
  "memory_type": "HBM3e",
  "memory_bus_width_bits": 6016,
  "memory_bandwidth_gbps": 4800,
  "ecc_supported": true,
  "nvlink_generation": 4,
  "nvlink_bandwidth_gbps": 900,
  "nvlink_max_domain_size": 8,
  "pcie_generation": 5,
  "pcie_bandwidth_gbps": 128,
  "c2c_bandwidth_gbps": null,
  "cuda_cores": null,
  "tensor_cores": null,
  "tensor_core_generation": 4,
  "rt_cores": null,
  "rt_core_generation": null,
  "sm_count": null,
  "multi_instance_max": 7,
  "last_verified": "2026-09-06",
  "notes": "Per the H200 datasheet's footnote convention (footnote 2: 'With sparsity'), FP64/FP64 Tensor Core/FP32 are dense figures; TF32/BF16/FP16/FP8/INT8 Tensor Core figures are sparse-only, no independently published dense value -- dense fields for those left null rather than derived. FP6 Tensor Core not applicable (Hopper does not support FP6, introduced in Blackwell). cuda_cores/tensor_cores/sm_count left null: despite thorough searching, NVIDIA has never published H200-specific core-count figures in any official datasheet, product brief, or architecture document -- third-party sites assume H200 reuses H100 SXM5's GH100 die figures (132 SM / 16,896 CUDA cores / 528 Tensor Cores), which is plausible but not an NVIDIA-confirmed H200 figure, so left unpopulated. process_node_nm of 4 (TSMC 4N) IS directly sourced for H200 specifically -- NVIDIA's Hopper architecture page names H200 by product name in the same sentence as the TSMC 4N claim ('Built with over 80 billion transistors using a cutting edge TSMC 4N process... fuel the NVIDIA H200 and H100 Tensor Core GPUs'), which is a stronger citation than the H200 product datasheet itself (which only says 'Based on the NVIDIA Hopper architecture' without restating the process node). release_date of 2023-11-13 is NVIDIA's official H200 announcement at SC23. Memory bandwidth stated as '4.8TB/s' in the main H200 datasheet; the H200 NVL product brief independently states a more precise 4,813 GB/s for the same underlying HBM3e config -- consistent, not a discrepancy (4800 used here as the datasheet's own headline figure). MIG: up to 7 instances @ 18GB each.",
  "sources": [
    "https://www.nvidia.com/en-us/data-center/h200/"
  ],
  "_sources": {
    "memory_bus_width_bits": "H200 NVL Product Brief (PB-12128-001_v01), Table 2-2 -- bus width figure stated for H200 NVL's HBM3e config, same die/memory subsystem as H200 SXM",
    "nvlink_generation": "NVIDIA HGX H100 and HGX H200 Datasheet (doc 3361709, Jul'24): 'NVLink: Fourth generation'",
    "process_node_nm": "https://www.nvidia.com/en-us/data-center/technologies/hopper-architecture/ ('Built with over 80 billion transistors using a cutting edge TSMC 4N process... fuel the NVIDIA H200 and H100 Tensor Core GPUs')",
    "release_date": "https://nvidianews.nvidia.com/news/nvidia-supercharges-hopper-the-worlds-leading-ai-computing-platform (SC23 press release, Nov 13 2023)"
  }
}
