{
  "schema_version": "1.0.0",
  "name": "L4",
  "aliases": [],
  "manufacturer": "NVIDIA",
  "architecture": "Ada Lovelace",
  "gpu_chip": "AD104",
  "process_node_nm": 4,
  "release_date": "2023-03-21",
  "status": "shipping",
  "form_factor": "PCIe",
  "sxm_generation": null,
  "nvlink_bridge_gpu_count": null,
  "slot_width": 1,
  "tdp_watts_max": 72,
  "cooling_type": null,
  "fp64_tflops": null,
  "fp64_tensor_tflops": null,
  "fp32_tflops": 30.3,
  "tf32_tensor_tflops": 60,
  "tf32_tensor_sparse_tflops": 120,
  "fp16_tflops": null,
  "fp16_tensor_tflops": 121,
  "fp16_tensor_sparse_tflops": 242,
  "bf16_tensor_tflops": 121,
  "bf16_tensor_sparse_tflops": 242,
  "fp8_tensor_tflops": 242.5,
  "fp8_tensor_sparse_tflops": 485,
  "fp6_tensor_tflops": null,
  "fp6_tensor_sparse_tflops": null,
  "fp4_tensor_tflops": null,
  "fp4_tensor_sparse_tflops": null,
  "int8_tensor_tops": 242.5,
  "int8_tensor_sparse_tops": 485,
  "memory_capacity_gb": 24,
  "memory_type": "GDDR6",
  "memory_bus_width_bits": null,
  "memory_bandwidth_gbps": 300,
  "ecc_supported": null,
  "nvlink_generation": null,
  "nvlink_bandwidth_gbps": null,
  "nvlink_max_domain_size": null,
  "pcie_generation": 4,
  "pcie_bandwidth_gbps": 64,
  "c2c_bandwidth_gbps": null,
  "cuda_cores": null,
  "tensor_cores": null,
  "tensor_core_generation": 4,
  "rt_cores": null,
  "rt_core_generation": 3,
  "sm_count": null,
  "multi_instance_max": null,
  "last_verified": "2026-09-06",
  "notes": "NVIDIA's L4 datasheet gives only the sparse (with-sparsity) figures for TF32/BF16/FP16/FP8/INT8 Tensor Core, with an explicit footnote: '*Shown with sparsity. Specifications 1/2 lower without sparsity.' -- unlike most other records in this dataset where dense figures are left null when not independently published, here the dense values recorded (half of sparse) are DERIVED per NVIDIA's own explicit halving rule stated in that footnote, not independently sourced. cuda_cores/tensor_cores/sm_count not found: NVIDIA's L4 datasheet and product page state Tensor Core generation (4th) and RT Core generation (3rd) by name only, with no numeric core counts given anywhere. gpu_chip of AD104 and process_node_nm of 4 (TSMC 4N) ARE directly NVIDIA-sourced, contrary to an earlier belief in this dataset that no NVIDIA doc names L4's die -- NVIDIA's own 'Ada GPU Architecture' whitepaper (a separate document from the L4 product datasheet/page) explicitly tabulates 'GPU Code Name: AD104' for L4 (Appendix D, Table 5) and states Ada-generation GPUs are fabricated on 'TSMC's 4N manufacturing process' generation-wide. Note some third-party sources (TechPowerUp) label this node numerically as '5 nm' while still tagging it '4N FinFET' -- TSMC's '4N' is a customized 5nm-class node, not a true linear 4nm process; 4 is recorded here as the marketing-name-derived integer, consistent with how H100/H200/B200/B300's TSMC 4N/4NP process is recorded elsewhere in this dataset. release_date of 2023-03-21 is NVIDIA's GTC Spring 2023 announcement. No NVLink (PCIe-only card, absent from datasheet). multi_instance_max null: L4 does not appear in NVIDIA's official MIG-supported-GPU list.",
  "sources": [
    "https://www.nvidia.com/en-us/data-center/l4/"
  ],
  "_sources": {
    "multi_instance_max": "https://docs.nvidia.com/datacenter/tesla/mig-user-guide/supported-gpus.html (MIG-supported GPU list does not include L4)",
    "tensor_core_generation": "https://www.nvidia.com/en-us/data-center/l4/ (datasheet PDF text, p.2: '4th-generation Tensor Cores')",
    "gpu_chip": "https://images.nvidia.com/aem-dam/Solutions/Data-Center/l4/nvidia-ada-gpu-architecture-whitepaper-V2.02.pdf (Appendix D, Table 5: 'GPU Code Name: AD104 [L4]')",
    "process_node_nm": "https://images.nvidia.com/aem-dam/Solutions/Data-Center/l4/nvidia-ada-gpu-architecture-whitepaper-V2.02.pdf ('Ada GPUs are fabricated on TSMC's 4N manufacturing process', generation-wide statement, not an AD104-specific sentence)",
    "release_date": "https://nvidianews.nvidia.com/news/nvidia-launches-inference-platforms-for-large-language-models-and-generative-ai-workloads (GTC Spring 2023, March 21 2023)",
    "slot_width": "https://www.nvidia.com/content/dam/en-zz/Solutions/Data-Center/l4/PB-11316-001_v01.pdf ('Mechanical form factor: HHHL-SS (half-height, half-length, single-slot)')"
  }
}
