{
  "schema_version": "1.0.0",
  "name": "A10",
  "aliases": [],
  "manufacturer": "NVIDIA",
  "architecture": "Ampere",
  "gpu_chip": "GA102",
  "process_node_nm": 8,
  "release_date": "2021-04-12",
  "status": "shipping",
  "form_factor": "PCIe",
  "sxm_generation": null,
  "nvlink_bridge_gpu_count": null,
  "slot_width": 1,
  "tdp_watts_max": 150,
  "cooling_type": null,
  "fp64_tflops": null,
  "fp64_tensor_tflops": null,
  "fp32_tflops": 31.2,
  "tf32_tensor_tflops": 62.5,
  "tf32_tensor_sparse_tflops": 125,
  "fp16_tflops": null,
  "fp16_tensor_tflops": 125,
  "fp16_tensor_sparse_tflops": 250,
  "bf16_tensor_tflops": 125,
  "bf16_tensor_sparse_tflops": 250,
  "fp8_tensor_tflops": null,
  "fp8_tensor_sparse_tflops": null,
  "fp6_tensor_tflops": null,
  "fp6_tensor_sparse_tflops": null,
  "fp4_tensor_tflops": null,
  "fp4_tensor_sparse_tflops": null,
  "int8_tensor_tops": 250,
  "int8_tensor_sparse_tops": 500,
  "memory_capacity_gb": 24,
  "memory_type": "GDDR6",
  "memory_bus_width_bits": null,
  "memory_bandwidth_gbps": 600,
  "ecc_supported": null,
  "nvlink_generation": null,
  "nvlink_bandwidth_gbps": null,
  "nvlink_max_domain_size": null,
  "pcie_generation": 4,
  "pcie_bandwidth_gbps": 64,
  "c2c_bandwidth_gbps": null,
  "cuda_cores": null,
  "tensor_cores": null,
  "tensor_core_generation": 3,
  "rt_cores": 72,
  "rt_core_generation": 2,
  "sm_count": null,
  "multi_instance_max": null,
  "last_verified": "2026-09-11",
  "notes": "NVIDIA's own-branded A10 -- distinct from AWS's A10G (see gpus/a10g.json), confirmed via an official AWS-published NVIDIA A10G datasheet showing meaningfully different specs (A10G: 300W TDP, FP32 35 TFLOPS, 80 RT cores vs A10's 150W, 31.2 TFLOPS, 72 RT cores). Do not treat these as the same part under two names. Note A10G's Tensor Core throughput (TF32/BF16/FP16/INT8) is actually LOWER than A10's despite A10G's higher TDP and RT core count -- see gpus/a10g.json notes for the full comparison and a flagged anomaly (A10G's TF32 dense equals its FP32, not 2x FP32 as on every other Ampere part in this dataset including A10). cuda_cores/tensor_cores/sm_count not stated numerically in official NVIDIA A10 docs (only 'third-generation Tensor Cores' and '72 (2nd-generation) RT Cores' given by name/count respectively). No NVLink (PCIe-only card, confirmed absent from both A10 datasheet and product brief). multi_instance_max null: A10 Product Brief explicitly states 'Multi-Instance GPU (MIG): Not supported'. process_node_nm of 8 (Samsung 8nm '8N' custom process) is NOT found in any official NVIDIA A10 document -- it is corroborated only by three independent third-party aggregator sources (no disagreement among them), and is recorded here as best-available with that caveat; treat with lower confidence than fields sourced directly from NVIDIA. Note Samsung's '8N' is itself a custom/enhanced 10nm-class process marketed as '8nm', not a strict linear feature size -- 8 is an approximation of a marketing name. release_date of 2021-04-12 is NVIDIA's GTC21 announcement date, confirmed via NVIDIA press release/blog, distinct from AWS's separate, later A10G announcement (2021-11-11/12, see gpus/a10g.json) -- these are two different announcement events for two different products, not the same date. No FP64 or FP8 Tensor Core figures given (FP8 postdates Ampere; FP64 not listed on this datasheet).",
  "sources": [
    "https://www.nvidia.com/content/dam/en-zz/Solutions/Data-Center/a10/pdf/datasheet-new/nvidia-a10-datasheet.pdf"
  ],
  "_sources": {
    "gpu_chip": "https://www.nvidia.com/content/dam/en-zz/Solutions/Data-Center/a10/pdf/A10-Product-Brief.pdf (Table 1, Product Specifications: GPU 'GA102-890', SKU 'PG133 SKU 215')",
    "process_node_nm": "Not NVIDIA-primary-sourced -- corroborated by 3 independent third-party sites: videocardz.net/nvidia-a10 ('Fabrication Process: 8 nm (SAMSUNG 8N)'), sysrqmts.com GPU comparison ('Foundry: Samsung / Manufacturing process: 8 nm'), geeks3d.com GTC 2021 roundup ('process: Samsung 8nm' for the related GA102 A5000/A6000 SKUs)",
    "release_date": "https://nvidianews.nvidia.com/news/nvidia-and-global-computer-makers-launch-industry-standard-enterprise-server-platforms-for-ai (GTC21, April 12 2021)",
    "rt_cores": "https://www.nvidia.com/content/dam/en-zz/Solutions/Data-Center/a10/pdf/datasheet-new/nvidia-a10-datasheet.pdf ('72 (2nd-generation) RT Cores')",
    "tensor_core_generation": "https://www.nvidia.com/content/dam/en-zz/Solutions/Data-Center/a10/pdf/datasheet-new/nvidia-a10-datasheet.pdf ('3rd-generation Tensor Cores')",
    "multi_instance_max": "https://www.nvidia.com/content/dam/en-zz/Solutions/Data-Center/a10/pdf/A10-Product-Brief.pdf (Table 3, Software Specifications: 'Multi-Instance GPU (MIG): Not supported')",
    "pcie_generation": "https://www.nvidia.com/content/dam/en-zz/Solutions/Data-Center/a10/pdf/A10-Product-Brief.pdf ('PCI Express 4.0 x16, x8; PCIe 3.0 x16')",
    "slot_width": "https://www.nvidia.com/content/dam/en-zz/Solutions/Data-Center/a10/pdf/A10-Product-Brief.pdf (Table 1: 'Mechanical Form Factor: Full-height, full-length (FHFL) 10.5\", single slot')"
  }
}
